"ranking","name","highSchool","position","height","weight","stars","rating","college"
1,"D.J. Williams","De La Salle (Concord, CA)","ILB","6-2","235",5,"0.9998","Miami"
2,"Brock Berlin","Evangel Christian Academy (Shreveport, LA)","PRO","6-2","190",5,"0.9998","Florida"
3,"Charles Rogers","Saginaw (Saginaw, MI)","WR","6-4","195",5,"0.9988","Michigan State"
4,"Travis Johnson","Notre Dame (Sherman Oaks, CA)","SDE","6-4","265",5,"0.9982","Florida State"
5,"Marcus Houston","Thomas Jefferson (Denver, CO)","RB","6-0","208",5,"0.9980","Colorado"
6,"Kwame Harris","Newark (Newark, DE)","OT","6-7","320",5,"0.9978","Stanford"
7,"B.J. Johnson","South Grand Prairie (Grand Prairie, TX)","WR","6-1","190",5,"0.9976","Texas"
8,"Bryant McFadden","McArthur (Hollywood, FL)","CB","6-1","182",5,"0.9968","Florida State"
9,"Sam Maldonado","Harrison (Harrison, NY)","RB","6-2","215",5,"0.9964","Ohio State"
10,"Mike Munoz","Archbishop Moeller (Cincinnati, OH)","OT","6-7","290",5,"0.9960","Tennessee"
11,"Willis McGahee","Miami Central (Miami, FL)","RB","6-1","215",5,"0.9948","Miami"
12,"Antonio Hall","McKinley (Canton, OH)","OT","6-5","295",5,"0.9946","Kentucky"
13,"Darrell Lee","Kirkwood (Saint Louis, MO)","WDE","6-5","230",5,"0.9940","Florida"
14,"O.J. Owens","North Stanly (New London, NC)","S","6-1","195",5,"0.9932","Tennessee"
15,"Jeff Smoker","Manheim Central (Manheim, PA)","PRO","6-3","190",5,"0.9922","Michigan State"
16,"Marco Cooper","Cass Technical (Detroit, MI)","OLB","6-2","235",5,"0.9918","Ohio State"
17,"Chance Mock","The Woodlands (The Woodlands, TX)","PRO","6-2","190",5,"0.9918","Texas"
18,"Roy Williams","Permian (Odessa, TX)","WR","6-4","202",5,"0.9916","Texas"
19,"Matt Grootegoed","Mater Dei (Santa Ana, CA)","OLB","5-11","205",5,"0.9914","USC"
20,"Yohance Buchanan","Douglass (Atlanta, GA)","S","6-1","210",5,"0.9912","Florida State"
21,"Mac Tyler","Jess Lanier (Hueytown, AL)","DT","6-6","320",5,"0.9912","Alabama"
22,"Jason Respert","Northside (Warner Robins, GA)","OC","6-3","300",5,"0.9902","Tennessee"
23,"Casey Clausen","Bishop Alemany (Mission Hills, CA)","PRO","6-4","215",5,"0.9896","Tennessee"
24,"Albert Means","Trezevant (Memphis, TN)","SDE","6-6","310",5,"0.9890","Alabama"
25,"Albert Hollis","Christian Brothers (Sacramento, CA)","RB","6-0","190",5,"0.9890","Georgia"
26,"Eric Moore","Pahokee (Pahokee, FL)","OLB","6-4","226",5,"0.9884","Florida State"
27,"Willie Dixon","Stockton Christian School (Stockton, CA)","WR","5-11","182",5,"0.9884","Miami"
28,"Cory Bailey","American (Hialeah, FL)","S","5-10","175",5,"0.9880","Florida"
29,"Sean Young","Northwest Whitfield County (Tunnel Hill, GA)","OG","6-6","293",5,"0.9878","Tennessee"
30,"Johnnie Morant","Parsippany Hills (Morris Plains, NJ)","WR","6-5","225",5,"0.9871","Syracuse"
31,"Wes Sims","Weatherford (Weatherford, OK)","OG","6-5","310",5,"0.9869","Oklahoma"
32,"Tyson Thompson","Bell (Irving, TX)","RB","6-2","195",5,"0.9869","TCU"
33,"Jason Campbell","Taylorsville (Taylorsville, MS)","PRO","6-5","190",5,"0.9853","Auburn"
34,"Antwan Odom","Alma Bryant (Irvington, AL)","SDE","6-7","260",5,"0.9851","Alabama"
35,"Sloan Thomas","Klein (Spring, TX)","WR","6-2","188",5,"0.9847","Texas"
36,"Raymond Mann","Hampton (Hampton, VA)","ILB","6-1","233",5,"0.9847","Virginia"
37,"Alphonso Townsend","Lima Central Catholic (Lima, OH)","DT","6-6","280",5,"0.9847","Ohio State"
38,"Greg Jones","Battery Creek (Beaufort, SC)","RB","6-2","245",5,"0.9837","Florida State"
39,"Chris Septak","Millard West (Omaha, NE)","TE","6-3","245",5,"0.9833","Nebraska"
40,"Paul Mociler","St. John Bosco (Bellflower, CA)","OG","6-5","300",5,"0.9833","UCLA"
41,"Eric Knott","Henry Ford II (Sterling Heights, MI)","TE","6-4","235",4,"0.9831","Michigan State"
42,"Harold James","Osceola (Osceola, AR)","S","6-1","220",4,"0.9827","Alabama"
43,"Chris Rix","Santa Margarita Catholic (Rancho Santa Margarita, CA)","PRO","6-4","200",4,"0.9827","Florida State"
44,"Teyo Johnson","Mira Mesa (San Diego, CA)","ATH","6-7","256",4,"0.9827","Stanford"
45,"Chris McKelvy","North Penn (Lansdale, PA)","OT","6-5","300",4,"0.9821","Penn State"
46,"Joe McGuire","Servite (Anaheim, CA)","OT","6-5","225",4,"0.9819","USC"
47,"Anthony Bryant","Sunshine Sch (Newbern, AL)","SDE","6-4","310",4,"0.9815","Alabama"
48,"Brock Edwards","Fort Worth Christian (North Richland Hills, TX)","TE","6-5","250",4,"0.9815","Texas"
49,"Carlos Perez","Hoboken (Hoboken, NJ)","WR","6-1","195",4,"0.9811","Florida"
50,"Adam Doiron","Duncan (Duncan, OK)","SDE","6-4","260",4,"0.9807","Texas"
51,"Tre Orr","Columbia (Lake City, FL)","S","6-2","190",4,"0.9805","Florida"
52,"Hobie Holiday","Houston County (Warner Robins, GA)","OLB","6-5","228",4,"0.9791","Georgia Tech"
53,"Shannon Snell","Hillsborough (Tampa, FL)","OG","6-6","305",4,"0.9791","Florida"
54,"Larry Stevens","Wilson (Tacoma, WA)","OLB","6-4","215",4,"0.9791","Michigan"
55,"Sam Ruhe","Walsh Jesuit (Stow, OH)","SDE","6-5","245",4,"0.9787","Penn State"
56,"Amon Gordon","Mira Mesa (San Diego, CA)","OLB","6-3","270",4,"0.9781","Stanford"
57,"Steve Lee","Evangel Christian Academy (Shreveport, LA)","DT","6-4","308",4,"0.9777","Texas"
58,"Reggie Vickers","Glades Central (Belle Glade, FL)","WR","6-0","175",4,"0.9775","Florida"
59,"Lawrence Richardson","Ball (Galveston, TX)","CB","5-10","170",4,"0.9773","Arkansas"
60,"Greg Pauly","South (Waukesha, WI)","DT","6-6","275",4,"0.9771","Notre Dame"
61,"Tim Johnson","Delbarton School (Morristown, NJ)","ILB","6-4","230",4,"0.9769","Penn State"
62,"Terrell Suggs","Hamilton (Chandler, AZ)","ATH","6-4","240",4,"0.9765","Arizona State"
63,"Chris Boggas","Irving (Irving, TX)","OT","6-5","310",4,"0.9763","Kansas State"
64,"Chad Mascoe","Osceola (Summit, MS)","ILB","6-3","225",4,"0.9761","Florida State"
65,"Carlos Joseph","Edison (Miami, FL)","OT","6-6","303",4,"0.9759","Miami"
66,"Adrian Mayes","Forest Brook (Houston, TX)","S","6-2","200",4,"0.9759","LSU"
67,"Tab Perry","Milpitas (Milpitas, CA)","WR","6-3","218",4,"0.9759","UCLA"
68,"Alex Holmes","Harvard Westlake (Studio City, CA)","TE","6-2","295",4,"0.9751","USC"
69,"Dan Dicks","Bellevue (Bellevue, WA)","OG","6-5","280",4,"0.9747","Washington"
70,"Carl Walker","Andrew Jackson (Jacksonville, FL)","S","6-3","190",4,"0.9747","Miami"
71,"Jason Richenberger","Liberty (Liberty, MO)","ILB","6-1","200",4,"0.9747","Nebraska"
72,"Jermelle Lewis","Bloomfield (Bloomfield, CT)","RB","6-1","215",4,"0.9745","Iowa"
73,"Vontez Duff","Copperas Cove (Copperas Cove, TX)","RB","6-1","175",4,"0.9743","Notre Dame"
74,"Adam Black","Cy Falls (Houston, TX)","CB","6-0","175",4,"0.9741","Texas A&M"
75,"Craig Ochs","Fairview (Boulder, CO)","PRO","6-2","205",4,"0.9739","Colorado"
76,"Carlyle Holiday","Roosevelt (San Antonio, TX)","WR","6-3","185",4,"0.9739","Notre Dame"
77,"Michael Boulware","Spring Valley (Columbia, SC)","OLB","6-3","200",4,"0.9737","Florida State"
78,"Justin Hinds","Piscataway Twp (Piscataway, NJ)","SDE","6-4","265",4,"0.9733","Boston College"
79,"Tyrell Dortch","Hoboken (Hoboken, NJ)","RB","6-0","195",4,"0.9725","Michigan State"
80,"Karlton Neal","Morgan Park (Chicago, IL)","WDE","6-5","235",4,"0.9723","Tennessee"
81,"Sean Poole","Central Commencement Academy (Flint, MI)","OT","6-7","285",4,"0.9719","Michigan State"
82,"Rashad Baker","Woodrow Wilson (Camden, NJ)","S","6-0","185",4,"0.9717","Tennessee"
83,"Will Smith","Thomas R Proctor (Utica, NY)","WDE","6-4","230",4,"0.9715","Ohio State"
84,"Keith Kelly","Colleton County (Walterboro, SC)","RB","6-0","205",4,"0.9715","Clemson"
85,"Tony Johnson","State College Area (State College, PA)","RB","6-1","205",4,"0.9709","Penn State"
86,"Zac Wasserman","Westlake (Thousand Oaks, CA)","PRO","6-4","203",4,"0.9707","Penn State"
87,"Darius Jones","Memorial (Beloit, WI)","ILB","6-4","250",4,"0.9703","Wisconsin"
88,"Brooks Daniels","Hamilton County (Jasper, FL)","OLB","6-3","200",4,"0.9699","Alabama"
89,"Erik Noll","Watkins Mill (Gaithersburg, MD)","OT","6-5","292",4,"0.9683","Penn State"
90,"Quinn Sypniewski","Johnston Senior (Johnston, IA)","TE","6-7","255",4,"0.9683","Colorado"
91,"Kelvin Kight","Lithonia (Lithonia, GA)","WR","6-0","185",4,"0.9679","Florida"
92,"Bo Mosley","Osceola (Osceola, AR)","CB","5-10","160",4,"0.9679","Arkansas"
93,"Andrew Walter","Grand Junction (Grand Junction, CO)","PRO","6-5","205",4,"0.9671","Arizona State"
94,"Brandon Sumner","Mainland (Daytona Beach, FL)","PRO","6-5","220",4,"0.9667","Georgia Tech"
95,"Vince Wilfork","Santaluces Community (Lake Worth, FL)","DT","6-1","310",4,"0.9667","Miami"
96,"Mike Goolsby","Joliet Catholic Academy (Joliet, IL)","ILB","6-4","225",4,"0.9663","Notre Dame"
97,"Derron Parquet","Archbishop Rummel (Metairie, LA)","RB","6-0","205",4,"0.9659","LSU"
98,"Diamond Ferri","Everett (Everett, MA)","RB","5-11","200",4,"0.9659","Syracuse"
99,"Alex Barron","Orangeburg-Wilkinson (Orangeburg, SC)","OT","6-8","297",4,"0.9657","Florida State"
100,"Sean McHugh","Chagrin Falls (Chagrin Falls, OH)","TE","6-6","245",4,"0.9655","Penn State"
101,"Bennie Mills","Archbishop Rummel (Metairie, LA)","DT","6-4","280",4,"0.9655","Florida"
102,"Ben Emanuel","Clear Brook (Friendswood, TX)","S","6-2","190",4,"0.9651","UCLA"
103,"Willie Green","Osceola (Kissimmee, FL)","RB","5-9","205",4,"0.9647","Florida"
104,"Chris Kelley","Seneca Valley (Germantown, MD)","PRO","6-2","205",4,"0.9647","Maryland"
105,"Robert Peace","Ruston (Ruston, LA)","ILB","6-3","215",4,"0.9643","Tennessee"
106,"Chris Young","South Panola (Batesville, MS)","WR","6-2","184",4,"0.9639","Vanderbilt"
107,"Ronnie Brown","Cartersville (Cartersville, GA)","RB","6-1","200",4,"0.9631","Auburn"
108,"Richard Johnson","Milford Mill Academy (Gwynn Oak, MD)","WR","6-0","170",4,"0.9629","Virginia Tech"
109,"Stephen Williams","Bolingbrook (Bolingbrook, IL)","SDE","6-3","275",4,"0.9627","Indiana"
110,"John Rattay","Desert Vista (Phoenix, AZ)","PRO","6-4","215",4,"0.9622","Tennessee"
111,"Tatum Bell","DeSoto (DeSoto, TX)","RB","5-11","190",4,"0.9618","Oklahoma State"
112,"Maurice Mitchell","Dougherty Comprehensive (Albany, GA)","OT","6-7","290",4,"0.9614","Alabama"
113,"Jason Peters","Queen City (Queen City, TX)","WDE","6-5","270",4,"0.9614","Arkansas"
114,"Cameron Wake","DeMatha Catholic (Hyattsville, MD)","WDE","6-3","258",4,"0.9610","Penn State"
115,"Doug Buckles","Madison Central (Madison, MS)","OG","6-5","275",4,"0.9610","Ole Miss"
116,"Jason Witten","Elizabethton (Elizabethton, TN)","WDE","6-7","265",4,"0.9606","Tennessee"
117,"Lynn McGruder","Cheyenne (North Las Vegas, NV)","DT","6-3","285",4,"0.9606","Tennessee"
118,"Dustin Picciotti","Central Bucks West (Doylestown, PA)","FB","6-3","235",4,"0.9602","Pittsburgh"
119,"Marcus White","Theodore (Theodore, AL)","SDE","6-5","270",4,"0.9602","Auburn"
120,"Nautyn McKay-Loescher","Toronto (Toronto, OH)","WDE","6-4","240",4,"0.9347","Alabama"